{
  "$schema": "https://json-schema.org/draft/2020-12/schema",
  "$id": "https://agentpass.dev/contracts/promotion-evidence-v1.schema.json",
  "title": "AgentPass release promotion evidence v1",
  "description": "A signed, public, durable binding of one source commit, product artifact, release manifest, product/controller notarization, and both independent hardware qualification lanes. All file names are basenames; paths, tokens, private keys, and raw credentials are forbidden.",
  "type": "object",
  "additionalProperties": false,
  "maxProperties": 13,
  "required": [
    "schema_version",
    "type",
    "promotion_id",
    "source",
    "artifact",
    "release_manifest",
    "notarization",
    "two_lane_qualification",
    "generated_at",
    "signing_purpose",
    "signature_algorithm",
    "signer_key_fingerprint",
    "signature"
  ],
  "properties": {
    "schema_version": { "const": 1 },
    "type": { "const": "agentpass.promotion-evidence" },
    "promotion_id": { "$ref": "#/$defs/uuid" },
    "source": { "$ref": "#/$defs/source" },
    "artifact": { "$ref": "#/$defs/artifact" },
    "release_manifest": { "$ref": "#/$defs/release_manifest" },
    "notarization": { "$ref": "#/$defs/notarization" },
    "two_lane_qualification": { "$ref": "#/$defs/two_lane_qualification" },
    "generated_at": { "$ref": "#/$defs/canonical_timestamp" },
    "signing_purpose": { "const": "AgentPass-Promotion-Evidence-v1\u0000" },
    "signature_algorithm": { "const": "ed25519" },
    "signer_key_fingerprint": { "$ref": "#/$defs/key_fingerprint" },
    "signature": { "$ref": "#/$defs/signature" }
  },
  "$defs": {
    "uuid": {
      "type": "string",
      "minLength": 36,
      "maxLength": 36,
      "pattern": "^[0-9a-f]{8}-[0-9a-f]{4}-[1-8][0-9a-f]{3}-[89ab][0-9a-f]{3}-[0-9a-f]{12}$"
    },
    "digest": {
      "type": "string",
      "minLength": 64,
      "maxLength": 64,
      "pattern": "^[0-9a-f]{64}$"
    },
    "commit": {
      "type": "string",
      "minLength": 40,
      "maxLength": 40,
      "pattern": "^[0-9a-f]{40}$"
    },
    "canonical_timestamp": {
      "type": "string",
      "minLength": 24,
      "maxLength": 24,
      "format": "date-time",
      "pattern": "^\\d{4}-\\d{2}-\\d{2}T\\d{2}:\\d{2}:\\d{2}\\.\\d{3}Z$"
    },
    "safe_name": {
      "type": "string",
      "minLength": 1,
      "maxLength": 255,
      "pattern": "^[0-9A-Za-z][0-9A-Za-z._-]{0,254}$"
    },
    "version": {
      "type": "string",
      "minLength": 1,
      "maxLength": 128,
      "pattern": "^[0-9A-Za-z][0-9A-Za-z.+~-]{0,127}$"
    },
    "key_fingerprint": {
      "type": "string",
      "minLength": 50,
      "maxLength": 50,
      "pattern": "^SHA256:[A-Za-z0-9_-]{43}$"
    },
    "signature": {
      "type": "string",
      "minLength": 86,
      "maxLength": 86,
      "pattern": "^[A-Za-z0-9_-]{86}$"
    },
    "file_digest": {
      "type": "object",
      "additionalProperties": false,
      "maxProperties": 3,
      "required": ["name", "bytes", "sha256"],
      "properties": {
        "name": { "$ref": "#/$defs/safe_name" },
        "bytes": { "type": "integer", "minimum": 1, "maximum": 17179869184 },
        "sha256": { "$ref": "#/$defs/digest" }
      }
    },
    "source": {
      "type": "object",
      "additionalProperties": false,
      "maxProperties": 4,
      "required": ["commit", "tree", "tag", "version"],
      "properties": {
        "commit": { "$ref": "#/$defs/commit" },
        "tree": { "$ref": "#/$defs/commit" },
        "tag": { "type": "string", "minLength": 2, "maxLength": 128, "pattern": "^v[0-9A-Za-z][0-9A-Za-z.+~-]{0,126}$" },
        "version": { "$ref": "#/$defs/version" }
      }
    },
    "artifact": {
      "type": "object",
      "additionalProperties": false,
      "maxProperties": 8,
      "required": ["name", "role", "media_type", "bytes", "sha256"],
      "properties": {
        "name": { "$ref": "#/$defs/safe_name" },
        "role": { "const": "product" },
        "media_type": { "enum": ["application/vnd.apple.installer+xml", "application/zip"] },
        "bytes": { "type": "integer", "minimum": 1, "maximum": 17179869184 },
        "sha256": { "$ref": "#/$defs/digest" }
      }
    },
    "release_manifest": {
      "type": "object",
      "additionalProperties": false,
      "maxProperties": 5,
      "required": ["schema_version", "name", "sha256", "signature_sha256", "signer_key_fingerprint"],
      "properties": {
        "schema_version": { "const": 3 },
        "name": { "$ref": "#/$defs/safe_name" },
        "sha256": { "$ref": "#/$defs/digest" },
        "signature_sha256": { "$ref": "#/$defs/digest" },
        "signer_key_fingerprint": { "$ref": "#/$defs/key_fingerprint" }
      }
    },
    "notarization_record": {
      "type": "object",
      "additionalProperties": false,
      "maxProperties": 3,
      "required": ["status", "submission_ids", "evidence"],
      "properties": {
        "status": { "const": "accepted_stapled" },
        "submission_ids": {
          "type": "array",
          "minItems": 1,
          "maxItems": 8,
          "uniqueItems": true,
          "items": { "$ref": "#/$defs/uuid" }
        },
        "evidence": {
          "type": "array",
          "minItems": 2,
          "maxItems": 2,
          "uniqueItems": true,
          "items": { "$ref": "#/$defs/notarization_evidence" }
        }
      }
    },
    "notarization_evidence": {
      "type": "object",
      "additionalProperties": false,
      "maxProperties": 4,
      "required": ["kind", "name", "bytes", "sha256"],
      "properties": {
        "kind": { "enum": ["notarytool_result", "stapler_result"] },
        "name": { "$ref": "#/$defs/safe_name" },
        "bytes": { "type": "integer", "minimum": 1, "maximum": 4194304 },
        "sha256": { "$ref": "#/$defs/digest" }
      }
    },
    "notarization": {
      "type": "object",
      "additionalProperties": false,
      "maxProperties": 2,
      "required": ["product", "external_controller"],
      "properties": {
        "product": { "$ref": "#/$defs/notarization_record" },
        "external_controller": { "$ref": "#/$defs/notarization_record" }
      }
    },
    "report": {
      "type": "object",
      "additionalProperties": false,
      "maxProperties": 3,
      "required": ["schema_version", "name", "sha256"],
      "properties": {
        "schema_version": { "const": 2 },
        "name": { "$ref": "#/$defs/safe_name" },
        "sha256": { "$ref": "#/$defs/digest" }
      }
    },
    "operator": {
      "type": "object",
      "additionalProperties": false,
      "maxProperties": 2,
      "required": ["name", "key_fingerprint"],
      "properties": {
        "name": { "type": "string", "minLength": 3, "maxLength": 128, "pattern": "^[A-Za-z0-9][A-Za-z0-9@._-]{2,127}$" },
        "key_fingerprint": { "$ref": "#/$defs/key_fingerprint" }
      }
    },
    "lane": {
      "oneOf": [
        { "$ref": "#/$defs/apple_lane" },
        { "$ref": "#/$defs/intel_lane" }
      ]
    },
    "lane_base": {
      "type": "object",
      "additionalProperties": false,
      "maxProperties": 7,
      "required": ["hardware_class", "architecture", "report", "report_signature", "operator", "evidence_archive", "release_manifest_sha256"],
      "properties": {
        "hardware_class": { "enum": ["apple_silicon", "intel_t2"] },
        "architecture": { "enum": ["arm64", "x86_64"] },
        "report": { "$ref": "#/$defs/report" },
        "report_signature": { "$ref": "#/$defs/file_digest" },
        "operator": { "$ref": "#/$defs/operator" },
        "evidence_archive": { "$ref": "#/$defs/file_digest" },
        "release_manifest_sha256": { "$ref": "#/$defs/digest" }
      }
    },
    "apple_lane": {
      "type": "object",
      "additionalProperties": false,
      "maxProperties": 7,
      "required": ["hardware_class", "architecture", "report", "report_signature", "operator", "evidence_archive", "release_manifest_sha256"],
      "properties": {
        "hardware_class": { "const": "apple_silicon" },
        "architecture": { "const": "arm64" },
        "report": { "$ref": "#/$defs/report" },
        "report_signature": { "$ref": "#/$defs/file_digest" },
        "operator": { "$ref": "#/$defs/operator" },
        "evidence_archive": { "$ref": "#/$defs/file_digest" },
        "release_manifest_sha256": { "$ref": "#/$defs/digest" }
      }
    },
    "intel_lane": {
      "type": "object",
      "additionalProperties": false,
      "maxProperties": 7,
      "required": ["hardware_class", "architecture", "report", "report_signature", "operator", "evidence_archive", "release_manifest_sha256"],
      "properties": {
        "hardware_class": { "const": "intel_t2" },
        "architecture": { "const": "x86_64" },
        "report": { "$ref": "#/$defs/report" },
        "report_signature": { "$ref": "#/$defs/file_digest" },
        "operator": { "$ref": "#/$defs/operator" },
        "evidence_archive": { "$ref": "#/$defs/file_digest" },
        "release_manifest_sha256": { "$ref": "#/$defs/digest" }
      }
    },
    "two_lane_qualification": {
      "type": "object",
      "additionalProperties": false,
      "maxProperties": 8,
      "required": ["schema_version", "status", "summary", "operator_policy", "release_manifest_sha256", "artifact_sha256", "source_commit", "lanes"],
      "properties": {
        "schema_version": { "const": 1 },
        "status": { "const": "qualified" },
        "summary": { "$ref": "#/$defs/file_digest" },
        "operator_policy": { "$ref": "#/$defs/file_digest" },
        "release_manifest_sha256": { "$ref": "#/$defs/digest" },
        "artifact_sha256": { "$ref": "#/$defs/digest" },
        "source_commit": { "$ref": "#/$defs/commit" },
        "lanes": {
          "type": "array",
          "minItems": 2,
          "maxItems": 2,
          "items": { "$ref": "#/$defs/lane" },
          "oneOf": [
            {
              "prefixItems": [
                { "$ref": "#/$defs/apple_lane" },
                { "$ref": "#/$defs/intel_lane" }
              ],
              "minItems": 2,
              "maxItems": 2,
              "items": false
            },
            {
              "prefixItems": [
                { "$ref": "#/$defs/intel_lane" },
                { "$ref": "#/$defs/apple_lane" }
              ],
              "minItems": 2,
              "maxItems": 2,
              "items": false
            }
          ]
        }
      }
    }
  }
}
